{
  "schema": "sce.search-request.proposal.v1",
  "scope": {
    "namespace": "fixture-private",
    "profile_id": "fixture-profile",
    "project_ids": [
      "sce"
    ]
  },
  "query": "моя идея",
  "mode": "EXACT_QUOTE",
  "revision_selector": "original-fixture-001",
  "time_field": "SOURCE_EVENT",
  "filters": {
    "source_types": [
      "txt"
    ],
    "topics": [],
    "goals": [],
    "statuses": []
  },
  "page_size": 20,
  "cursor": null
}
